{
  "schema": "p42-foundry-receipt-v1",
  "receipt_id": "sha256:74e16b33a91ea098a946f659dad85702d61eb0ef9cd9fdecd91d4e533e4d2103",
  "content_digest": "sha256:6c0eaed5e2298b7a9577a24b289d37ffdf29274f959269c96f04e44241df9858",
  "occurred_at": "2026-07-12T21:57:38Z",
  "frontier": "EinsteinArena scorer/verifier hardening: is there a concrete changed condition that justifies another diagnostic pass?",
  "action": "Consumed the current selector state and verified the existing control-receipt lineage; no scorer, verifier, or Arena API diagnostic was rerun.",
  "verified": "The frontier remains classified as control-plane-only. All four reopeners are absent: authorized CI observation, pre-commit request, selected legacy-surface promotion, and source/test drift. The prior selector-repeat result and its independent verification both pass.",
  "result": "Negative-result closure: this is an unchanged repeat, not a fresh hardening seam. Rotation is the correct action; no performance or submission claim is made.",
  "next_gate": "Reopen only on one concrete authorized condition: CI observation after push/PR, explicit pre-commit wiring, one selected legacy-surface promotion, or scorer/static-gate drift.",
  "boundary_held": "No production Atlas writes, external submissions, git pushes, or training unless explicitly authorized.",
  "classification": "progress",
  "evidence_class": "provisional",
  "source": {
    "job_id": "50c8e4391849",
    "run_file": "2026-07-12_15-57-38.md",
    "sha256": "bcdee807bf7ae9a1594bdeb4e094ba59bc31055203550b0b48a16ebaca8f1cee"
  }
}
