{
  "schema": "p42-foundry-receipt-v1",
  "receipt_id": "sha256:1d1828cba7ec1af4bb68456e152397e75e9ecd157a817fdda8489f7dae257283",
  "content_digest": "sha256:db5124e3b50b7296f13adcdf60c5691e1c33d84a4a487b1a4690afc0ad04c47a",
  "occurred_at": "2026-07-15T01:08:20Z",
  "frontier": "EinsteinArena scorer/verifier hardening — is there a concrete reopener this tick, or does the lane stay rotated away?",
  "action": "Read the full context packet, confirmed the frontier is in a selector-repeat / rotate-away state (priority 0.165, status non-executable). Materialized a bounded control-plane reaffirmation only: verified the prior verified classification, checked for changed-condition reopeners, recomputed protected DB hashes, and updated queue pointers idempotently. No Arena API, scorer, or preflight diagnostics were run.",
  "verified": "Verifier-only `reproduce.sh` passed all gates (classification match, changed-condition count = 0, same-window DB stability, queue entry found + non-executable + current-session pointer, queue final-SHA parity). `replication_certificate.json` status `pass`, no caveats. Protected DBs stable in-window (atlas / atlas2 / arena_atlas unchanged). Both JSONL ledgers parse as one object per line. experiment_id stale-ID hygiene patched and reproduction rerun clean.",
  "result": "`current_tick_selector_repeat_reaffirmed_control_plane_only` — zero concrete reopeners; recorded as `local_exhaustion` in the negative ledger. Queue priority decayed once 0.165 → 0.16, status set to `selector_repeat_reaffirmed_control_plane_only_nonexecutable`. No new Arena/math evidence produced or claimed; this is control-plane lineage upkeep, not scorer verification.",
  "next_gate": "`arena_scorer_hardening_rotate_away_until_concrete_reopener_else_selector_materializer_exact_receipt_consumption`. Reopen only on: authorized remote CI observation / push-or-PR, explicit pre-commit wiring request, exactly one selected legacy submit-surface promotion, or scorer / static-gate source-test drift. Otherwise route to selector/materializer exact-receipt consumption.",
  "boundary_held": "No production Atlas writes, external submissions, git pushes, or training unless explicitly authorized.",
  "classification": "blocked",
  "evidence_class": "provisional",
  "source": {
    "job_id": "50c8e4391849",
    "run_file": "2026-07-14_19-08-20.md",
    "sha256": "4e1631e87b8472d48f2631f8880437c0b5a5c7b889adb93de8ec8305fad25a5e"
  }
}
