{
  "schema": "p42-foundry-receipt-v1",
  "receipt_id": "sha256:2d4335b0a5f92272e21d313d55ad6de145e11c5df3ecfee5717cec7e987d2b24",
  "content_digest": "sha256:12efcc0a14dba0e588c2942ed921106cc67f4e096af70a9c20e85aee7293822c",
  "occurred_at": "2026-07-13T03:25:49Z",
  "frontier": "Whether EinsteinArena scorer/verifier hardening has a concrete new reopener.",
  "action": "Consumed the prior verified selector-repeat receipt; registered this tick as a bounded local-exhaustion control check. Scorer/static diagnostics were intentionally not rerun.",
  "verified": "Prior receipt: zero changed-condition markers, protected-input stability, forbidden-side-effect absence, and replication pass. New local receipt and negative-result record passed consistency validation.",
  "result": "No reopener was evidenced. The frontier remains closed/rotated; no queue mutation was made.",
  "next_gate": "Reopen only for authorized remote CI via push/PR, an explicit pre-commit wiring request, one selected legacy submit-surface promotion, or concrete scorer/static-gate source-test drift.",
  "boundary_held": "No production Atlas writes, external submissions, git pushes, or training unless explicitly authorized.",
  "classification": "blocked",
  "evidence_class": "provisional",
  "source": {
    "job_id": "50c8e4391849",
    "run_file": "2026-07-12_20-25-49.md",
    "sha256": "744c3e7df8206c7a71cdac3b6033ec04c5cc2cfd75325fde5991ee2fb229dd81"
  }
}
