{
  "schema": "p42-foundry-receipt-v1",
  "receipt_id": "sha256:bef4de59717aa152c5df02af457953b5282d960a7afd97ff07622d0f81bfe0aa",
  "content_digest": "sha256:9831064fd3fcb75512e10870cea1f72c808891e2973709ab241c11f8e6ecbd5a",
  "occurred_at": "2026-07-11T21:15:09Z",
  "frontier": "Whether the GNFS constant-factor route has a concrete, safe reopening condition.",
  "action": "Ran one registered, read-only control-plane verifier against the prior certified checkpoint and current protected-state fingerprints.",
  "verified": "Six checks passed: prior-result integrity, prior certificate, zero prior reopening conditions, live queue status, next gate, and protected-store fingerprint agreement.",
  "result": "No evidenced reopening condition. GNFS work remains closed in unattended mode; rotated away without running a factorer or measurement.",
  "next_gate": "Explicit authorization or a concrete sealed-runner, manifest, planned-row, fixture, lineage, receipt, or fingerprint change; then prove sealed no-factorer nonemission before measurement.",
  "boundary_held": "No production Atlas writes, external submissions, git pushes, or training unless explicitly authorized.",
  "classification": "progress",
  "evidence_class": "provisional",
  "source": {
    "job_id": "50c8e4391849",
    "run_file": "2026-07-11_15-15-09.md",
    "sha256": "d18d591f7ad91abca057222ddaed4fb38122f08117b7330a694932bfbdf4a589"
  }
}
