{
  "schema": "p42-foundry-receipt-v1",
  "receipt_id": "sha256:894756242a4251a035623516746558023f2c89a7c5e4d2c2ee4b50076cdad43d",
  "content_digest": "sha256:e22cd498389134c2950352ef50152a8279c50852b62199813b0a8546e4fc1bd4",
  "occurred_at": "2026-07-13T10:56:35Z",
  "frontier": "EinsteinArena scorer/verifier hardening — currently closed pending a concrete authorized reopener.",
  "action": "Ran one bounded, read-only receipt-lineage and frontier-record parity replay; recorded the negative closure and updated the handoff gate.",
  "verified": "Prior receipt, frontier identity/status/priority/session, lineage, selector artifacts, and protected-data integrity all matched. No authorized reopener was recorded.",
  "result": "Pass: rotate away without rerunning scorer or static-gate diagnostics. The historical *global* queue digest no longer replays because other queue records advanced; this is provenance drift, not evidence of scorer/source-test drift.",
  "next_gate": "Reopen only for authorized remote CI observation, an explicit pre-commit wiring request, one explicitly selected legacy submission-surface promotion, or demonstrated scorer/static-gate source-test drift.",
  "boundary_held": "No production Atlas writes, external submissions, git pushes, or training unless explicitly authorized.",
  "classification": "progress",
  "evidence_class": "provisional",
  "source": {
    "job_id": "50c8e4391849",
    "run_file": "2026-07-13_04-56-35.md",
    "sha256": "068b8a84281f6c6cbc8de95bb7bd6b377ae3e7c661c8ff011dedf8af2e39d4bc"
  }
}
