{
  "schema": "p42-foundry-receipt-v1",
  "receipt_id": "sha256:f3b2900670714a0ef6838989c59a0b777c83dd940a5e97280cda9b79922e4f71",
  "content_digest": "sha256:f24e3c2720e38d23c9062d28d1727bee2f736851b7b2e96c2b52555adb148654",
  "occurred_at": "2026-07-12T04:27:38Z",
  "frontier": "Can a GNFS route be reopened only after an auditable sealed-runner nonemission gate, rather than by repeating an unchanged checkpoint?",
  "action": "Designed and statically verified a six-obligation sealed no-factorer/nonemission contract; no runner or measurement was invoked.",
  "verified": "Replication passed all seven checks: contract completeness, defer-by-default admission, design-only status, unchanged queue, no runtime proof attempt, matching classification, and forbidden-side-effect absence.",
  "result": "A bounded next-experiment design is ready. It makes no GNFS-performance, factorization, or runtime-nonemission claim; execution remains deferred.",
  "next_gate": "Require explicit authorization or a concrete sealed-runner, manifest, planned-row, fixture, lineage, prior-receipt, or protected-hash change; then prove runner nonemission before any measurement.",
  "boundary_held": "No production Atlas writes, external submissions, git pushes, or training unless explicitly authorized.",
  "classification": "progress",
  "evidence_class": "provisional",
  "source": {
    "job_id": "50c8e4391849",
    "run_file": "2026-07-11_21-27-38.md",
    "sha256": "cc2584a9f7cf1de753d20e448d7599aaf51ff203c3225e1ab46aab8ff4ab6b8a"
  }
}
