{
  "schema": "p42-foundry-receipt-v1",
  "receipt_id": "sha256:c72ce278188cfdfeaa1946dc3190feef7b61eb0157b30c663f22b319aaef8bb6",
  "content_digest": "sha256:aaec980ebde76b589aef7ba52c4792f96ab01c492c3728acac26918f8c46a547",
  "occurred_at": "2026-07-14T02:28:22Z",
  "frontier": "FrontierMath large Steiner systems S(n,q,r) with n>q>r>5, r<10, n<200 — is there a concrete current-session artifact to justify reopening the solver lane?",
  "action": "Registered the tick as a control-plane experiment, then ran a read-only admissible-artifact scan over real-progress roots only (candidate_artifacts, solver, checkpoints, proofs, encodings, lift_maps, inputs), excluding control/prose roots. Hashed the three protected databases before and after, and updated the frontier queue pointer-only.",
  "verified": "admissible target-facing proof-producing encodings / exact-iff primary lift maps found: **0**; affirmative changed-condition markers (excluding reopener prose): **0**.\n- Protected DBs stable in-window (same-window before==after): atlas.db, atlas2.db, arena_atlas.db all unchanged, drift notes empty.\n- Queue updated pointer-only: priority 0.17→0.165 (single decay; prior last_session was a different run, so no double decay), status held at target-artifact-absence rotation, last_session advanced to current run.\n- Replication verifier re-read final receipts and confirmed admissible=0, changed=0, DB same-window stability, and queue-hash parity → `REPRODUCE_OK`, exit 0.",
  "result": "Negative / control-plane result: `current_tick_target_artifact_absence_rotation_reaffirmed_control_plane_only`. Logged as `local_exhaustion` in the negative ledger with a `do_not_retry_unless` naming a concrete target encoding or exact-iff lift map. No solvers, importers, candidates, or membranes rerun; no mathematical progress claimed.",
  "next_gate": "`real_target_proof_or_exact_iff_lift_artifact_required_else_rotate` — reopen only on a concrete current-session target-facing proof-producing encoding or exact-iff primary lift map (then import/parse + proof/decode/verifier smoke before any solver tranche). Otherwise rotate to another FrontierMath basin or selector/materializer receipt-consumption calibration.",
  "boundary_held": "No production Atlas writes, external submissions, git pushes, or training unless explicitly authorized.",
  "classification": "negative_result",
  "evidence_class": "provisional",
  "source": {
    "job_id": "50c8e4391849",
    "run_file": "2026-07-13_19-28-22.md",
    "sha256": "31896c775ad3bb584ef1a0a10cc38a7c579705bf86a65ae46913a502747060bc"
  }
}
